PE-FFAA-00173,114814470958,"Capitán de Bandada, Departamento Estrategia Digital",Masculino,Fuerza Aérea de Chile,Tercera jerarquía,Metropolitana de Santiago,Medio,Sí,"No, pero se está trabajando en esos temas",Inicial (prueba de concepto/un proyecto),,,,,,,,,,,,,,,,,,,,,,,,,,,,,,Automatización de procesos y gestión operativa,Mejora de la interacción con la ciudadanía,Analítica avanzada para la toma de decisiones,,,,,,,,Asistencia en emergencias y gestión de desastres,,,No,,,,,,,,,,,,,,,,,,,No,,Sí,Sí,,"Fundamentos de IA y conocimientos generales (Introducción a la IA, Ética en la IA, Privacidad y protección de datos, Gobernanza y estrategia en IA, etc.)","Habilidades técnicas (Análisis y gestión de datos, Machine Learning y Deep Learning, Ciberseguridad en entornos de IA, Integración de soluciones IA, etc.)",,,"Colaboración y cultura organizacional (Cambio cultural y liderazgo digital, Colaboración interinstitucional, Participación ciudadana y transparencia, etc.)",,Sí,04,"Optimización de procesos, analisis de documentación, ayuda a la ciudadanía.",No,,Procesos internos,Diseño y entrega de servicios públicos,,Optimización de tareas y procedimientos institucionales y analisis de documentos principalmente.,Algoritmo de busqueda de personas en imagenes aéreas.,N/A,"Ninguno, la institución siempre ha considerado a las personas como foco principal en todas sus actividades.","Se ha considerado la capacidad de auditar los algoritmos y codigos utilizados evitando el problema de la ""caja negra"".","Al momento no se ha trabajado con bases de datos ni información personal, sin embargo, se tiene considerado a futuro cumplir con los lineamientos de la ley 21.719 ""Protección y tratamiento de datos personales"".",No,,No,,Sí,No,,Alto,Sí,No,No,
PE-INS-00557,114800956968,JEFA DEPARTAMENTO DE INFORMÁTICA,Femenino,GENDARMERÍA DE CHILE,Otra,Metropolitana de Santiago,Bajo,No,,No se ha utilizado,,"Falta de conocimiento o comprensión sobre la IA (usos, beneficios)",,Falta de personal capacitado,Falta de infraestructura tecnológica,,Resistencia al cambio a nivel organizacional,"Incertidumbre sobre cómo usar la IA de forma legal, ética (regulaciones)",Percepción de que la IA no es relevante o útil,"Problemas éticos (por ejemplo, pérdida de trabajos o subestimación de labores)",Falta de apoyo de niveles más estratégicos para la adopción de la tecnología,,,Falta de personal capacitado en IA,Limitaciones de infraestructura tecnológica,,Presupuesto insuficiente para cubrir costos de implementación o mantenimiento,,,,,,Sí,No,,No,,,,,,,,,,,,,,,,,,,,,,,,,,,,,,,,,,,,,,,,,,,,,,,,,,,,,,,,,,,,,,,,,,,,,,,,
PE-GOR-00036,114803765144,Encargada de Transparencia activa/pasiva,Femenino,Gobierno Regional de la Región de Antofagasta,Tercera jerarquía,Antofagasta,Bajo,No,,No se ha utilizado,,,,,,"Preocupaciones de ciberseguridad (privacidad, vulnerabilidades y seguridad)",,"Incertidumbre sobre cómo usar la IA de forma legal, ética (regulaciones)",,"Problemas éticos (por ejemplo, pérdida de trabajos o subestimación de labores)",,,,,,,,,Preocupaciones de ciberseguridad (riesgos asociados como vulnerabilidades de los algoritmos o fugas de datos que puedan ser sensibles),,,,No,,,No,,,,,,,,,,,,,,,,,,,,,,,,,,,,,,,,,,,,,,,,,,,,,,,,,,,,,,,,,,,,,,,,,,,,,,,,
PE-GOR-00098,114804688780,Encargado Administración de los Sistemas Informáticos ,Masculino,Gobierno Regional de la Región de Atacama,Otra,Atacama,Bajo,No,,No se ha utilizado,,"Falta de conocimiento o comprensión sobre la IA (usos, beneficios)",,Falta de personal capacitado,,,,,,,Falta de apoyo de niveles más estratégicos para la adopción de la tecnología,,,,,,,,Preocupaciones de ciberseguridad (riesgos asociados como vulnerabilidades de los algoritmos o fugas de datos que puedan ser sensibles),,Complejidad de la gestión de cambios tecnológicos,No existe gobernanza que lidere la implementación de nuevas tecnologías en el servicio,No,,,No,,,,,,,,,,,,,,,,,,,,,,,,,,,,,,,,,,,,,,,,,,,,,,,,,,,,,,,,,,,,,,,,,,,,,,,,
PE-GOR-00131,114809396864,Coordinador de Transformación / Profesional de Informática,Masculino,Gobierno Regional de la Región Aysén del General Carlos Ibáñez del Campo,Segunda jerarquía,Aysén del General Carlos Ibáñez del Campo,Bajo,No,,En evaluación,,"Falta de conocimiento o comprensión sobre la IA (usos, beneficios)",,Falta de personal capacitado,,,,,Percepción de que la IA no es relevante o útil,,,,,Falta de personal capacitado en IA,,Dificultades de integración de soluciones con los sistemas existentes,,Falta de datos de calidad para entrenar modelos (en caso de soluciones a medida),,,,,No,,,No,,,,,,,,,,,,,,,,,,,,,,,,,,,,,,,,,,,,,,,,,,,,,,,,,,,,,,,,,,,,,,,,,,,,,,,,
PE-GOR-00561,114805736958,Profesional Departamento de Informática,Masculino,Gobierno Regional de la Región de Coquimbo,Tercera jerarquía,Coquimbo,Bajo,No,,No se ha utilizado,,"Falta de conocimiento o comprensión sobre la IA (usos, beneficios)",,Falta de personal capacitado,,,,,,,,Poco interés de la institución en general,,Falta de personal capacitado en IA,,,Presupuesto insuficiente para cubrir costos de implementación o mantenimiento,,,,,Poco interés de la institución en general,No,,,No,,,,,,,,,,,,,,,,,,,,,,,,,,,,,,,,,,,,,,,,,,,,,,,,,,,,,,,,,,,,,,,,,,,,,,,,
PE-GOR-00565,114798377330,Profesional Informática ,Masculino,Gobierno Regional de la Región del Maule,Otra,Maule,Bajo,No,,No se ha utilizado,,"Falta de conocimiento o comprensión sobre la IA (usos, beneficios)",,Falta de personal capacitado,Falta de infraestructura tecnológica,"Preocupaciones de ciberseguridad (privacidad, vulnerabilidades y seguridad)",Resistencia al cambio a nivel organizacional,,,,,,,Falta de personal capacitado en IA,Limitaciones de infraestructura tecnológica,,,Falta de datos de calidad para entrenar modelos (en caso de soluciones a medida),Preocupaciones de ciberseguridad (riesgos asociados como vulnerabilidades de los algoritmos o fugas de datos que puedan ser sensibles),,,,Sí,No,,No,,,,,,,,,,,,,,,,,,,,,,,,,,,,,,,,,,,,,,,,,,,,,,,,,,,,,,,,,,,,,,,,,,,,,,,,
No tiene código,114799126094,Subdirector TI,Masculino,"Hospital Clínico de la Fuerza Aérea de Chile ""Gral. Dr. Raúl Yazigi Jauregui""",Tercera jerarquía,Metropolitana de Santiago,Medio,Sí,"Sí, pero sólo para algunos datos",En evaluación,,,,,,"Preocupaciones de ciberseguridad (privacidad, vulnerabilidades y seguridad)",,,,,,"1.- Existe una brecha para estar en un nivel de desarrollo Tecnologica y digitalización adecuado para implentar IA. 2.- Aun hay procesos en papel, datos no normalizados o estandarizados, etc.  3.- Priorizacion de proyectos, hay necesidades de inversion más importantes. ",,,,,Presupuesto insuficiente para cubrir costos de implementación o mantenimiento,Falta de datos de calidad para entrenar modelos (en caso de soluciones a medida),,,Complejidad de la gestión de cambios tecnológicos,,Sí,No,,No,,,,,,,,,,,,,,,,,,,,,,,,,,,,,,,,,,,,,,,,,,,,,,,,,,,,,,,,,,,,,,,,,,,,,,,,
PE-OTR-01979,114811203057,Jefe TIC,Masculino,"Hospital El Carmen ""Dr. Luis Valentín Ferrada""",Segunda jerarquía,Metropolitana de Santiago,Bajo,Sí,No,No se ha utilizado,,,,Falta de personal capacitado,Falta de infraestructura tecnológica,,,"Incertidumbre sobre cómo usar la IA de forma legal, ética (regulaciones)",,,,,,Falta de personal capacitado en IA,,Dificultades de integración de soluciones con los sistemas existentes,Presupuesto insuficiente para cubrir costos de implementación o mantenimiento,,,,,,No,,,No,,,,,,,,,,,,,,,,,,,,,,,,,,,,,,,,,,,,,,,,,,,,,,,,,,,,,,,,,,,,,,,,,,,,,,,,
PE-INS-02982,114814221701,Jefe ESCALON Proyectos,Femenino,Instituto de Investigaciones y Control,Segunda jerarquía,Metropolitana de Santiago,Bajo,No,,No se ha utilizado,,,Costos elevados de implementación,Falta de personal capacitado,Falta de infraestructura tecnológica,"Preocupaciones de ciberseguridad (privacidad, vulnerabilidades y seguridad)",Resistencia al cambio a nivel organizacional,,Percepción de que la IA no es relevante o útil,,Falta de apoyo de niveles más estratégicos para la adopción de la tecnología,,,Falta de personal capacitado en IA,Limitaciones de infraestructura tecnológica,,Presupuesto insuficiente para cubrir costos de implementación o mantenimiento,,Preocupaciones de ciberseguridad (riesgos asociados como vulnerabilidades de los algoritmos o fugas de datos que puedan ser sensibles),,Complejidad de la gestión de cambios tecnológicos,,No,,,No,,,,,,,,,,,,,,,,,,,,,,,,,,,,,,,,,,,,,,,,,,,,,,,,,,,,,,,,,,,,,,,,,,,,,,,,
PE-INS-00545,114803570222,Informático ,Masculino,Instituto Nacional de Desarrollo Sustentable de la Pesca Artesanal y de la Acuicultura de Pequeña Escala,Otra,Valparaíso,Bajo,No,,No se ha utilizado,,"Falta de conocimiento o comprensión sobre la IA (usos, beneficios)",Costos elevados de implementación,Falta de personal capacitado,Falta de infraestructura tecnológica,"Preocupaciones de ciberseguridad (privacidad, vulnerabilidades y seguridad)",Resistencia al cambio a nivel organizacional,"Incertidumbre sobre cómo usar la IA de forma legal, ética (regulaciones)",,,Falta de apoyo de niveles más estratégicos para la adopción de la tecnología,No se cuenta con personal suficiente,,Falta de personal capacitado en IA,Limitaciones de infraestructura tecnológica,Dificultades de integración de soluciones con los sistemas existentes,Presupuesto insuficiente para cubrir costos de implementación o mantenimiento,Falta de datos de calidad para entrenar modelos (en caso de soluciones a medida),Preocupaciones de ciberseguridad (riesgos asociados como vulnerabilidades de los algoritmos o fugas de datos que puedan ser sensibles),Escalabilidad de las soluciones,Complejidad de la gestión de cambios tecnológicos,No se cuenta con personal suficiente,No,,,No,,,,,,,,,,,,,,,,,,,,,,,,,,,,,,,,,,,,,,,,,,,,,,,,,,,,,,,,,,,,,,,,,,,,,,,,
PE-INS-00067,114800290752,Coordinador de Transformación Digital,Femenino,Instituto de Salud Pública de Chile,Dependencia directa del jefe superior,Metropolitana de Santiago,Bajo,No,,No se ha utilizado,,"Falta de conocimiento o comprensión sobre la IA (usos, beneficios)",,Falta de personal capacitado,,,Resistencia al cambio a nivel organizacional,,,,,,,Falta de personal capacitado en IA,,,,Falta de datos de calidad para entrenar modelos (en caso de soluciones a medida),,,,,No,,,Sí,No,,,,,,,,,,,,,,,,,,,,,,,,,,,,,,,,,,,,,,,,,,,,,,,,,,,,,,,,,,,,,,,,,,,,,,,
PE-INS-00023,114815769632,Jefatura del Departamento de Tecnologías de la Información,Femenino,Instituto de Seguridad Laboral,Dependencia directa del jefe superior,Metropolitana de Santiago,Bajo,Sí,"Sí, para todos los datos",En evaluación,,,,Falta de personal capacitado,Falta de infraestructura tecnológica,,,,,,,,,Falta de personal capacitado en IA,Limitaciones de infraestructura tecnológica,,,,,,,,Sí,No,,Sí,No,,,,,,,,,,,,,,,,,,,,,,,,,,,,,,,,,,,,,,,,,,,,,,,,,,,,,,,,,,,,,,,,,,,,,,,
PE-INS-00551,114800225606,Encargado Sección I+D,Masculino,Instituto Geográfico Militar,Segunda jerarquía,Metropolitana de Santiago,Bajo,No,,No se ha utilizado,,,,Falta de personal capacitado,Falta de infraestructura tecnológica,"Preocupaciones de ciberseguridad (privacidad, vulnerabilidades y seguridad)",,,,,,,,Falta de personal capacitado en IA,Limitaciones de infraestructura tecnológica,,,,Preocupaciones de ciberseguridad (riesgos asociados como vulnerabilidades de los algoritmos o fugas de datos que puedan ser sensibles),,,,No,,,No,,,,,,,,,,,,,,,,,,,,,,,,,,,,,,,,,,,,,,,,,,,,,,,,,,,,,,,,,,,,,,,,,,,,,,,,
PE-INS-00745,114812772807,Encargado de tecnologías de información,Masculino,Instituto Nacional de Derechos Humanos,Segunda jerarquía,Metropolitana de Santiago,Bajo,No,,Inicial (prueba de concepto/un proyecto),,,,,,,,,,,,,,,,,,,,,,,,,,,,,,,Mejora de la interacción con la ciudadanía,,,,,,,,,,,,No,,,,,,,,,,,,,,,,,,,No,,No,Sí,,"Fundamentos de IA y conocimientos generales (Introducción a la IA, Ética en la IA, Privacidad y protección de datos, Gobernanza y estrategia en IA, etc.)","Habilidades técnicas (Análisis y gestión de datos, Machine Learning y Deep Learning, Ciberseguridad en entornos de IA, Integración de soluciones IA, etc.)",,,"Colaboración y cultura organizacional (Cambio cultural y liderazgo digital, Colaboración interinstitucional, Participación ciudadana y transparencia, etc.)",,No,1,Mejorar la interacción con la ciudadanía a través de un chatbot con IA,Sí,,,Diseño y entrega de servicios públicos,,,Interacción mediante chatbot para entrega de información ciudadana.,No hay,Conocimiento técnico,no aplica,no aplica,No,,No,,No,No,,Bajo,No,No,No,
PE-INS-00547,114799259895,Encargado de Ciberseguridad e Infraestructura,Masculino,Instituto Nacional de la Juventud,Segunda jerarquía,Metropolitana de Santiago,Bajo,No,,No se ha utilizado,,"Falta de conocimiento o comprensión sobre la IA (usos, beneficios)",Costos elevados de implementación,Falta de personal capacitado,Falta de infraestructura tecnológica,"Preocupaciones de ciberseguridad (privacidad, vulnerabilidades y seguridad)",Resistencia al cambio a nivel organizacional,"Incertidumbre sobre cómo usar la IA de forma legal, ética (regulaciones)",,,,,,Falta de personal capacitado en IA,Limitaciones de infraestructura tecnológica,Dificultades de integración de soluciones con los sistemas existentes,,,Preocupaciones de ciberseguridad (riesgos asociados como vulnerabilidades de los algoritmos o fugas de datos que puedan ser sensibles),,,,No,,,No,,,,,,,,,,,,,,,,,,,,,,,,,,,,,,,,,,,,,,,,,,,,,,,,,,,,,,,,,,,,,,,,,,,,,,,,
PE-INS-00546,114798297607,Encargado de Inteligencia de Negocios,Masculino,Instituto Nacional de Propiedad Industrial,Dependencia directa del jefe superior,Metropolitana de Santiago,Alto,Sí,"No, pero se está trabajando en esos temas",Avanzado (varios proyectos en IA),,,,,,,,,,,,,,,,,,,,,,,,,,,,,,Automatización de procesos y gestión operativa,Mejora de la interacción con la ciudadanía,Analítica avanzada para la toma de decisiones,,,,,,,,,,Apoyo a la gestión administrativa (en curso),No,,,,,,,,,,,,,,,,,,,Sí,No,Sí,Sí,,"Fundamentos de IA y conocimientos generales (Introducción a la IA, Ética en la IA, Privacidad y protección de datos, Gobernanza y estrategia en IA, etc.)","Habilidades técnicas (Análisis y gestión de datos, Machine Learning y Deep Learning, Ciberseguridad en entornos de IA, Integración de soluciones IA, etc.)",,"Áreas de aplicación práctica (Automatización de procesos, Análisis predictivo y toma de decisiones basadas en datos, Atención al ciudadano, Seguridad y monitoreo, etc.)",,,Sí,2 implementados y 3 en desarrollo,2,Sí,,Procesos internos,,,"- Clasificador de imágenes con IA: El sistema utiliza Machine Learning para detectar automáticamente similitudes visuales entre los logos de nuevas solicitudes de marcas y aquellos previamente registrados en INAPI, optimizando el proceso de búsqueda y reduciendo el riesgo de conflictos por similitud gráfica.    - Exámen de Forma con Inteligencia Artificial Generativa: El examen de forma en el registro de marcas requiere analizar la descripción de productos/servicios, la cual debe corresponder con una de las 45 clases de la Clasificación Internacional de Niza. Una descripción incorrecta puede ocasionar vulnerabilidades en el registro y potenciales conflictos legales. Para optimizar este proceso crítico, se implementó un sistema de Inteligencia Artificial Generativa que verifica automáticamente la coherencia entre la descripción del usuario y la clase Niza seleccionada, mejorando la precisión y seguridad del registro marcario.    - Esas dos iniciativas se encuentran debidamente implementadas y operando","- En una primera etapa nuestro objetivo es entregar a los usuarios la posibilidad de acceder al clasificador de marcas con inteligencia artificial para facilitar la presentación de marcas.    - otra iniciativa tiene relación con soporte al área de atención de usuarios para responder preguntas a los funcionarios. Para esto este año trabajaremos en la implementación de un CRM cuya base de datos, estará integrada con un modelo de Inteligencia Artificial, previamente entrenado con preguntas frecuentes.",- Examen Sustantivo de Marcas con Inteligencia Artificial Generativa.  - Sistema de jurisprudencia de fallos de marcas y patentes.  - Sistema de análisis de datos y generación de estadísticas con IA.,Involucrar a la ciudadanía en el diseño de la solución.,"Hemos tenido dificultades en la apertura de la solución a la ciudadanía. Nuestro mayor temor radica en: Mal uso de la API por parte de los agentes de Propiedad Industrial. Por otro lado, errores de recomendación de la IA, que podrían resultar en solicitudes mal presentadas producto de una mala recomendación realizada por la IA.","Este ha sido el proceso más complejo, en estos momentos estamos intentando utilizar modelos que funcionan en local como Llama 3 de Meta para asegurar la confidencialidad y privacidad en el uso de datos.",Sí,Sí,Sí,"Realizamos el curso de formulación de proyectos de ciencia de datos impartido por la UAI. Para estos proyectos INAPI no ha utilizado datos personales. Sin embargo, una de las dificultades iniciales que encontramos tenía relación con la publicación de la transparencia de los modelos de IA generativa, su operación en los distintos  proveedores de IA generativa (Open AI, Antrhopic, Google, Meta, entre otros). ",No,No,,Bajo,No,No,Sí,No
PE-SER-00141,114805755520,COORDINADOR DE TRANSFORMACION DIGITAL,Femenino,Junta de Aeronáutica Civil,Segunda jerarquía,Metropolitana de Santiago,Bajo,No,,No se ha utilizado,,"Falta de conocimiento o comprensión sobre la IA (usos, beneficios)",,,,"Preocupaciones de ciberseguridad (privacidad, vulnerabilidades y seguridad)",,"Incertidumbre sobre cómo usar la IA de forma legal, ética (regulaciones)",,,,,,Falta de personal capacitado en IA,Limitaciones de infraestructura tecnológica,,Presupuesto insuficiente para cubrir costos de implementación o mantenimiento,,,,,,No,,,No,,,,,,,,,,,,,,,,,,,,,,,,,,,,,,,,,,,,,,,,,,,,,,,,,,,,,,,,,,,,,,,,,,,,,,,,
PE-SER-00140,114800212492,Coordinador de Transformación Digital,Masculino,Junta Nacional de Auxilio Escolar y Becas,Otra,Metropolitana de Santiago,Bajo,No,,No se ha utilizado,,"Falta de conocimiento o comprensión sobre la IA (usos, beneficios)",Costos elevados de implementación,Falta de personal capacitado,Falta de infraestructura tecnológica,,,"Incertidumbre sobre cómo usar la IA de forma legal, ética (regulaciones)",,,,,,Falta de personal capacitado en IA,Limitaciones de infraestructura tecnológica,Dificultades de integración de soluciones con los sistemas existentes,Presupuesto insuficiente para cubrir costos de implementación o mantenimiento,,,,,,No,,,No,,,,,,,,,,,,,,,,,,,,,,,,,,,,,,,,,,,,,,,,,,,,,,,,,,,,,,,,,,,,,,,,,,,,,,,,
PE-SER-00139,114809452587,"Encargada Oficina de Proyectos, Sección de Tecnologías de la Información.",Femenino,Junta Nacional de Jardines Infantiles,Tercera jerarquía,Metropolitana de Santiago,Bajo,Sí,"No, pero se está trabajando en esos temas",No se ha utilizado,,"Falta de conocimiento o comprensión sobre la IA (usos, beneficios)",,Falta de personal capacitado,,,,,,,,No se ha incentivado el uso de la IA institucionalmente,,Falta de personal capacitado en IA,,,,,,,,,No,,,No,,,,,,,,,,,,,,,,,,,,,,,,,,,,,,,,,,,,,,,,,,,,,,,,,,,,,,,,,,,,,,,,,,,,,,,,
PE-MIN-00521,114809400589,Encargado de Departamento de TI,Masculino,"Ministerio de Ciencia, Tecnología, Conocimiento e Innovación",Tercera jerarquía,Metropolitana de Santiago,Medio,Sí,"No, pero se está trabajando en esos temas",Inicial (prueba de concepto/un proyecto),,,,,,,,,,,,,,,,,,,,,,,,,,,,,,,,,,,,,,Diseño y mejora de políticas públicas basadas en datos,,,Monitoreo y evaluación de proyectos,,No,,,,,,,,,,,,,,,,,,,No,,No,Sí,,"Fundamentos de IA y conocimientos generales (Introducción a la IA, Ética en la IA, Privacidad y protección de datos, Gobernanza y estrategia en IA, etc.)","Habilidades técnicas (Análisis y gestión de datos, Machine Learning y Deep Learning, Ciberseguridad en entornos de IA, Integración de soluciones IA, etc.)","Gestión y evaluación de proyectos IA (Diseño y desarrollo de proyectos IA, Selección de proveedores y evaluación de propuestas, Evaluación del impacto y resultados, etc.)",,,,No,1,2,No,,Procesos internos,,Elaboración o apoyo de políticas,"Revisión de bases de licitación, consultas a bases, gobernanza de datos.",Gobernanza de datos.,Gobernanza de datos.,"Falta de dotación, sobrecarga laboral, múltiples funciones por funcionario.","Falta de dotación, sobrecarga laboral, múltiples funciones por funcionario.","Falta de dotación, sobrecarga laboral, múltiples funciones por funcionario.",No,,No,,No,No,,Bajo,No,No,No,
PE-MIN-00541,114798486275,Jefe Depto. Análisis de la Información Social,Masculino,Ministerio de Desarrollo Social y Familia,Tercera jerarquía,Metropolitana de Santiago,Bajo,Sí,"Sí, para todos los datos",Inicial (prueba de concepto/un proyecto),,,,,,,,,,,,,,,,,,,,,,,,,,,,,,Automatización de procesos y gestión operativa,Mejora de la interacción con la ciudadanía,,,"Detección de fraudes, comportamientos anómalos y ciberseguridad",,,,,,,,,Sí,,,,,,,,,Falta de personal capacitado,Desconocimiento sobre las tecnologías disponibles,,,,Preocupaciones sobre privacidad y ética,,,,,No,,Sí,Sí,,"Fundamentos de IA y conocimientos generales (Introducción a la IA, Ética en la IA, Privacidad y protección de datos, Gobernanza y estrategia en IA, etc.)",,"Gestión y evaluación de proyectos IA (Diseño y desarrollo de proyectos IA, Selección de proveedores y evaluación de propuestas, Evaluación del impacto y resultados, etc.)","Áreas de aplicación práctica (Automatización de procesos, Análisis predictivo y toma de decisiones basadas en datos, Atención al ciudadano, Seguridad y monitoreo, etc.)",,,Sí,Aproximadamente 4,"Las expectativas dependen del proyecto. Un proyecto consistió en la utlización de IA para la clasificación de documentos de identidad escaneados. La expectativa fue poder apoyar el trabajo de ejecutores municipales a la hora de atender a la ciudadanía. Si bien existe un piloto, no ha sido puesto en producción.",Sí,,Procesos internos,Diseño y entrega de servicios públicos,,Un proyecto de proceso interno es el mencionado anteriormente: se busca implementar un modelo de IA que sea capaz de recibir un archivo que contiene documentos de identidad escaneados por un funcionario municipal y extraer automáticamente información contenida.,Se está trabajando con un proveedor en la implementación de un agente virtual (también conocido como chatbot) que sea capaz de contestar preguntas de la ciudadanía referidas al Registro Social de Hogares.,No hay.,"No ha habido dificultades con aplicar este lineamiento. Con cada proyecto de IA considerado, se ha evaluado la pertinencia de IA como solución. Para prevenir la discriminación, se ha iniciado la práctica de realizar evaluaciones internas de los sistemas que utilizan IA, identificando sesgos estadísticos.",No ha habido dificultades con aplicar este lineamiento.,Los proyectos de IA realizados en el Ministerio de Desarrollo Social y Familia han tomado en cuenta el marco normativo de privacidad de datos que rige al mismo.,No,,No,,Sí,No,,Alto,Sí,Sí,Sí,No
