PE-SSS-00073,114809270172,ENCARGADO DE LA SECCIÓN DESARROLLO DE SISTEMAS,Masculino,Servicio de Salud Arica,Tercera jerarquía,Arica y Parinacota,Bajo,No,,No se ha utilizado,,"Falta de conocimiento o comprensión sobre la IA (usos, beneficios)",Costos elevados de implementación,Falta de personal capacitado,Falta de infraestructura tecnológica,"Preocupaciones de ciberseguridad (privacidad, vulnerabilidades y seguridad)",,,,,,,,Falta de personal capacitado en IA,Limitaciones de infraestructura tecnológica,Dificultades de integración de soluciones con los sistemas existentes,Presupuesto insuficiente para cubrir costos de implementación o mantenimiento,,Preocupaciones de ciberseguridad (riesgos asociados como vulnerabilidades de los algoritmos o fugas de datos que puedan ser sensibles),,,,Sí,No,,No,,,,,,,,,,,,,,,,,,,,,,,,,,,,,,,,,,,,,,,,,,,,,,,,,,,,,,,,,,,,,,,,,,,,,,,,
PE-SSS-00078,114805859626,Jefe Departamento de Tecnologia de la Informacion,Masculino,Servicio de Salud Concepción,Segunda jerarquía,Biobío,Bajo,No,,No se ha utilizado,,"Falta de conocimiento o comprensión sobre la IA (usos, beneficios)",,Falta de personal capacitado,Falta de infraestructura tecnológica,"Preocupaciones de ciberseguridad (privacidad, vulnerabilidades y seguridad)",Resistencia al cambio a nivel organizacional,"Incertidumbre sobre cómo usar la IA de forma legal, ética (regulaciones)",,,Falta de apoyo de niveles más estratégicos para la adopción de la tecnología,,,Falta de personal capacitado en IA,Limitaciones de infraestructura tecnológica,Dificultades de integración de soluciones con los sistemas existentes,Presupuesto insuficiente para cubrir costos de implementación o mantenimiento,,Preocupaciones de ciberseguridad (riesgos asociados como vulnerabilidades de los algoritmos o fugas de datos que puedan ser sensibles),Escalabilidad de las soluciones,Complejidad de la gestión de cambios tecnológicos,,No,,,No,,,,,,,,,,,,,,,,,,,,,,,,,,,,,,,,,,,,,,,,,,,,,,,,,,,,,,,,,,,,,,,,,,,,,,,,
PE-SSS-00142,114799072663,Jefatura TIC,Masculino,Servicio de Salud Los Ríos,Tercera jerarquía,Los Ríos,Bajo,No,,No se ha utilizado,,,,Falta de personal capacitado,Falta de infraestructura tecnológica,,,,,,Falta de apoyo de niveles más estratégicos para la adopción de la tecnología,,,Falta de personal capacitado en IA,Limitaciones de infraestructura tecnológica,,Presupuesto insuficiente para cubrir costos de implementación o mantenimiento,,,,,,No,,,No,,,,,,,,,,,,,,,,,,,,,,,,,,,,,,,,,,,,,,,,,,,,,,,,,,,,,,,,,,,,,,,,,,,,,,,,
PE-SSS-00084,114809568935,Jefe TIC ,Femenino,Servicio de Salud Metropolitano Central,Tercera jerarquía,Metropolitana de Santiago,Bajo,No,,No se ha utilizado,,"Falta de conocimiento o comprensión sobre la IA (usos, beneficios)",Costos elevados de implementación,Falta de personal capacitado,Falta de infraestructura tecnológica,,,,,,,,,Falta de personal capacitado en IA,Limitaciones de infraestructura tecnológica,,Presupuesto insuficiente para cubrir costos de implementación o mantenimiento,,,,,,No,,,No,,,,,,,,,,,,,,,,,,,,,,,,,,,,,,,,,,,,,,,,,,,,,,,,,,,,,,,,,,,,,,,,,,,,,,,,
PE-SSS-00086,114803675274,Jefe Unidad de Gestión Tecnológica y Desarrollo,Masculino,Servicio de Salud Metropolitano Occidente,Segunda jerarquía,Metropolitana de Santiago,Bajo,No,,En evaluación,,,Costos elevados de implementación,Falta de personal capacitado,Falta de infraestructura tecnológica,"Preocupaciones de ciberseguridad (privacidad, vulnerabilidades y seguridad)",,"Incertidumbre sobre cómo usar la IA de forma legal, ética (regulaciones)",,,,,,Falta de personal capacitado en IA,,,Presupuesto insuficiente para cubrir costos de implementación o mantenimiento,,Preocupaciones de ciberseguridad (riesgos asociados como vulnerabilidades de los algoritmos o fugas de datos que puedan ser sensibles),,,Falta de evidencia y/o certidumbre respecto al uso de esta tecnología emergente con datos de salud privados,Sí,No,,Sí,No,,,,,,,,,,,,,,,,,,,,,,,,,,,,,,,,,,,,,,,,,,,,,,,,,,,,,,,,,,,,,,,,,,,,,,,
PE-SSS-00087,114798302650,Desarrollador,Masculino,Servicio de Salud Metropolitano Oriente,Segunda jerarquía,Metropolitana de Santiago,Medio,Sí,No,No se ha utilizado,,"Falta de conocimiento o comprensión sobre la IA (usos, beneficios)",,,,,,,,,,Falta de Proyectos en donde aplique el uso de la IA,,,,,Presupuesto insuficiente para cubrir costos de implementación o mantenimiento,,Preocupaciones de ciberseguridad (riesgos asociados como vulnerabilidades de los algoritmos o fugas de datos que puedan ser sensibles),,,,Sí,No,,Sí,No,,,,,,,,,,,,,,,,,,,,,,,,,,,,,,,,,,,,,,,,,,,,,,,,,,,,,,,,,,,,,,,,,,,,,,,
PE-SSS-00168,114799982354,123456789,Masculino,Servicio de Salud Valparaíso - San Antonio,Tercera jerarquía,Valparaíso,Bajo,No,,En evaluación,,"Falta de conocimiento o comprensión sobre la IA (usos, beneficios)",,Falta de personal capacitado,Falta de infraestructura tecnológica,,,,,,Falta de apoyo de niveles más estratégicos para la adopción de la tecnología,,,,,Dificultades de integración de soluciones con los sistemas existentes,,,Preocupaciones de ciberseguridad (riesgos asociados como vulnerabilidades de los algoritmos o fugas de datos que puedan ser sensibles),Escalabilidad de las soluciones,,,Sí,No,,No,,,,,,,,,,,,,,,,,,,,,,,,,,,,,,,,,,,,,,,,,,,,,,,,,,,,,,,,,,,,,,,,,,,,,,,,
PE-SER-00157,114815793557,Jefe Sección Gestión de Datos y Estudios Institucionales,Masculino,Servicio de Tesorerías,Dependencia directa del jefe superior,Metropolitana de Santiago,Alto,Sí,"Sí, pero sólo para algunos datos",Avanzado (varios proyectos en IA),,,,,,,,,,,,,,,,,,,,,,,,,,,,,,Automatización de procesos y gestión operativa,Mejora de la interacción con la ciudadanía,Analítica avanzada para la toma de decisiones,,"Detección de fraudes, comportamientos anómalos y ciberseguridad",,,,Diseño y mejora de políticas públicas basadas en datos,,,,,Sí,,,,Capacidad de adquisición limitada,Ausencia de estándares para la contratación de IA,,,,,Desconocimiento sobre las tecnologías disponibles,,,,Preocupaciones sobre privacidad y ética,,,Ausencia de métricas claras,,Sí,No,Sí,Sí,,"Fundamentos de IA y conocimientos generales (Introducción a la IA, Ética en la IA, Privacidad y protección de datos, Gobernanza y estrategia en IA, etc.)","Habilidades técnicas (Análisis y gestión de datos, Machine Learning y Deep Learning, Ciberseguridad en entornos de IA, Integración de soluciones IA, etc.)","Gestión y evaluación de proyectos IA (Diseño y desarrollo de proyectos IA, Selección de proveedores y evaluación de propuestas, Evaluación del impacto y resultados, etc.)",,,,Sí,"Hay 3 proyectos grandes en fase beta y otros dos en fase de pruebas, sin contar todos aquellos proyectos para analítica de datos avanzada que se han desarrollado para toma de decisiones","Automatizaciones de procesos, predicción de variables y probabilidades, mejoras en aspectos de análisis de datos y mejoras en atención ciudadana",Sí,,Procesos internos,Diseño y entrega de servicios públicos,Elaboración o apoyo de políticas,"Modelo de riesgo de convenios la cual tiene por objetivo predecir la caducidad de convenios de pago mediante algoritmos de ML. Actualmente se está trabajando en operativizar el modelo en nuestros sistemas. Modelo de segmentación y dotación de tesorerías con foco en people analytics utilizando algoritmos de ML (clustering/segmentación). Análisis de bases de datos de  reclamos, felicitaciones y sugerencias utilizando Gemini para identificación de puntos de mejora, cumplimiento de scripts de respuestas y evaluación de las respuestas. Bot para Transcripción y análisis de audios de Contact Center para evaluar cumplimiento de guiones. Adicionalmente se han desarrollado análisis de bases de datos utilizando Gen AI para tomas de decisiones en virtud de solicitudes de información","Nos encontramos en etapa beta y pruebas adicionales para bot de análisis de contenidos  de sitio web en virtud de analizar inclusividad de los textos dispuestos en nuestro centro de ayuda. Se desarrollaron tres principales instrucciones para análisis masivo (lenguaje sexista, lenguaje sexista y lenguaje inclusivo y no despectivo). El foco es mejorar un servicio de información al usuario de forma, inclusiva transparente y clara.","De forma complementaria se ha utilizado ML y Gen AI para análisis de datos masivos para el diseño de políticas públicas como lo fue el diseño de los árboles de condonación de la política de condonación conjunta con SII (amnistías tributarias) sin contar otros análisis derivados de solicitudes de información de servicios de Hacienda, como la Subsecretaría de dicho servicio","El diseño con participación de la ciudadanía o el involucramiento de la ciudadanía en el diseño e implementación. Debido al carácter técnico y reservado que requiere por ejemplo la elaboración de un modelo de riesgo, es complejo hacer partícipe a la ciudadanía debido a que podrían, eventualmente, verse expuestas las estrategias de cobro. No obstante, se ha hecho un trabajo conjunto con el GobLab de la UAI para evaluar si nuestros algoritmos tenían sesgos o discriminación arbitraria. Con respecto al uso y aplicación de IA en procesos internos, no se visualizaba cómo podían afectar a la Ciudadanía sin un impacto directo.",Dado que aún estamos en un proceso de pruebas y adecuación no hemos tenido que desarrollar la estrategia para la transparencia y explicabilidad. La principal dificultad que vemos está en la gestión del cambio institucional y el desarrollo de planes comunicacionales hacia la ciudadanía con una estrategia que permita resguardar los intereses del fisco y compatibilizarlos con los intereses de la ciudadanía.,"Hasta ahora había sido el no tener un marco regulatorio claro. Hace muy poco se encontraba en discusión legislativa la ley de protección de datos personales (hoy ya publicada) la que podía eventualmente generar cambios en definiciones y lineamientos. La principal dificultad se encuentra en movilizar y capacitar a la institución hacia definiciones institucionales en cuanto a la protección de los datos personales. A pesar de todo esto, se tenía como referencia la actual ley que normaba estos temas.",Sí,Sí,Sí,"La principal dificultad principalmente se daba que dado el poco conocimiento en materias de IA que se tiene dentro de la institución (salvo el equipo especialista), fue necesaria la capacitación presencial/online y material audiovisual que facilitara la aplicación de la guía esto porque al leer sólo el documento quedan algunas dudas que sólo son resueltas en instancias presenciales. Para nuestro caso, lo que se hizo es hacer adaptaciones del documento a nuestra realidad lo que se concretó en una guía metodológica oficial para la elaboración de estudios que utilizaran Ciencia de Datos en TGR",Sí,No,,Moderado,Sí,No,Sí,No
CA-SER-00708,114809592938,Jefe división Tecnología de la Información.,Masculino,Servicio Electoral,Dependencia directa del jefe superior,Metropolitana de Santiago,Bajo,Sí,"No, pero se está trabajando en esos temas",Inicial (prueba de concepto/un proyecto),,,,,,,,,,,,,,,,,,,,,,,,,,,,,,,Mejora de la interacción con la ciudadanía,,,,,,,,,,,,No,,,,,,,,,,,,,,,,,,,No,,Sí,Sí,,,"Habilidades técnicas (Análisis y gestión de datos, Machine Learning y Deep Learning, Ciberseguridad en entornos de IA, Integración de soluciones IA, etc.)",,"Áreas de aplicación práctica (Automatización de procesos, Análisis predictivo y toma de decisiones basadas en datos, Atención al ciudadano, Seguridad y monitoreo, etc.)",,,No,1,1,No,,,Diseño y entrega de servicios públicos,,,Atención ciudadana de consultas de electores,No Aplica,NA,NA,NA,No,,No,,Sí,No,,Bajo,No,No,No,
PE-SER-00606,114810897993,Encargado Tecnologías de Información,Masculino,Servicio Local de Educación Pública de Llanquihue,Segunda jerarquía,Los Lagos,Bajo,No,,En evaluación,,"Falta de conocimiento o comprensión sobre la IA (usos, beneficios)",Costos elevados de implementación,Falta de personal capacitado,Falta de infraestructura tecnológica,"Preocupaciones de ciberseguridad (privacidad, vulnerabilidades y seguridad)",,"Incertidumbre sobre cómo usar la IA de forma legal, ética (regulaciones)",,,,,,Falta de personal capacitado en IA,Limitaciones de infraestructura tecnológica,Dificultades de integración de soluciones con los sistemas existentes,Presupuesto insuficiente para cubrir costos de implementación o mantenimiento,,Preocupaciones de ciberseguridad (riesgos asociados como vulnerabilidades de los algoritmos o fugas de datos que puedan ser sensibles),Escalabilidad de las soluciones,,,Sí,No,,No,,,,,,,,,,,,,,,,,,,,,,,,,,,,,,,,,,,,,,,,,,,,,,,,,,,,,,,,,,,,,,,,,,,,,,,,
PE-SER-00109,114799886487,Profesional /Encargado (S) Departamento de Informática,Masculino,Servicio Médico Legal,Segunda jerarquía,Metropolitana de Santiago,Bajo,No,,No se ha utilizado,,,,,,,Resistencia al cambio a nivel organizacional,"Incertidumbre sobre cómo usar la IA de forma legal, ética (regulaciones)",,,Falta de apoyo de niveles más estratégicos para la adopción de la tecnología,,,,,Dificultades de integración de soluciones con los sistemas existentes,,Falta de datos de calidad para entrenar modelos (en caso de soluciones a medida),,,Complejidad de la gestión de cambios tecnológicos,,No,,,No,,,,,,,,,,,,,,,,,,,,,,,,,,,,,,,,,,,,,,,,,,,,,,,,,,,,,,,,,,,,,,,,,,,,,,,,
PE-SER-00105,114815914594,Jefe Unidad de Informática,Masculino,Servicio Nacional de la Mujer y la Equidad de Género,Segunda jerarquía,Metropolitana de Santiago,Bajo,No,,No se ha utilizado,,"Falta de conocimiento o comprensión sobre la IA (usos, beneficios)",,Falta de personal capacitado,,"Preocupaciones de ciberseguridad (privacidad, vulnerabilidades y seguridad)",,"Incertidumbre sobre cómo usar la IA de forma legal, ética (regulaciones)",,,,,,Falta de personal capacitado en IA,,,Presupuesto insuficiente para cubrir costos de implementación o mantenimiento,,Preocupaciones de ciberseguridad (riesgos asociados como vulnerabilidades de los algoritmos o fugas de datos que puedan ser sensibles),,,,Sí,No,,No,,,,,,,,,,,,,,,,,,,,,,,,,,,,,,,,,,,,,,,,,,,,,,,,,,,,,,,,,,,,,,,,,,,,,,,,
PE-SER-00101,114816900265,Jefe de Subdivisión de Tecnologías de la Información,Masculino,Servicio Nacional del Adulto Mayor,Tercera jerarquía,Metropolitana de Santiago,Bajo,No,,No se ha utilizado,,,Costos elevados de implementación,Falta de personal capacitado,,"Preocupaciones de ciberseguridad (privacidad, vulnerabilidades y seguridad)",,,,,,,,Falta de personal capacitado en IA,,Dificultades de integración de soluciones con los sistemas existentes,Presupuesto insuficiente para cubrir costos de implementación o mantenimiento,Falta de datos de calidad para entrenar modelos (en caso de soluciones a medida),,,,,Sí,No,,Sí,No,,,,,,,,,,,,,,,,,,,,,,,,,,,,,,,,,,,,,,,,,,,,,,,,,,,,,,,,,,,,,,,,,,,,,,,
PE-SER-00100,114799376413,Jefe de departamento de tecnología e informática,Masculino,Servicio Nacional del Consumidor,Tercera jerarquía,Metropolitana de Santiago,Medio,Sí,"No, pero se está trabajando en esos temas",Inicial (prueba de concepto/un proyecto),,,,,,,,,,,,,,,,,,,,,,,,,,,,,,,,,Selección de casos de fiscalización,,,,,,,,,Analisis cuantitativo y cualitativo de problematicas de consumo en grandes volumenes de reclamos.,No,,,,,,,,,,,,,,,,,,,No,,Sí,Sí,,"Fundamentos de IA y conocimientos generales (Introducción a la IA, Ética en la IA, Privacidad y protección de datos, Gobernanza y estrategia en IA, etc.)","Habilidades técnicas (Análisis y gestión de datos, Machine Learning y Deep Learning, Ciberseguridad en entornos de IA, Integración de soluciones IA, etc.)",,"Áreas de aplicación práctica (Automatización de procesos, Análisis predictivo y toma de decisiones basadas en datos, Atención al ciudadano, Seguridad y monitoreo, etc.)",,,No,"2 proyectos, El primero de analisis de reclamos (indicado previamente) y el segundo de analisis de cumplimiento de garantia legal en venta de productos en distintos marketplace. ","En el analisis de reclamos que la IA pudiera clasificar y sintetizar, dados los altos volumenes de reclamos, en un tiempo mucho mas corto que el que le tomaria a funcionarios, problematicas de consumo. En el proyecto de cumplimiento de garantia legal detectar no cumplimiento legales por parte de los marketplaces.",Sí,,Procesos internos,,,Las dos inicitivas descritas previamente.,No aplica,No aplica,No hemos tenido dificultades en este ámbito debido a que los usos de la IA que hemos aplicado en los dos proyectos descritos previamente no han tenido relación directa con las personas ni con decisiones directas con la ciudadanía ni con los funcionarios de la institución.,"Al ser los proyectos que hemos desarrollado relacionados con procesos internos, no hemos experimentado dificultades en transparencia y explicabilidad.","Mas que dificultades tuvimos que tomar un conjunto de consideraciones técnicas respecto de la privacidad de los datos, al estar procesando reclamos de la ciudadania, implementado modelos con recursos internos sin comunicación con el exterior, al no contar con los recursos económicos para contratar capacidades de procesamiento de IA externos que garanticen la seguridad y privacidad del tratamiento de los datos.",Sí,Sí,No,,No,No,,Bajo,No,No,Sí,No
PE-SER-00099,114812904985,Proyectos Tecnológicos y Transformación Digital,Masculino,Servicio Nacional del Patrimonio Cultural,Dependencia directa del jefe superior,Metropolitana de Santiago,Medio,No,,Inicial (prueba de concepto/un proyecto),,,,,,,,,,,,,,,,,,,,,,,,,,,,,,,Mejora de la interacción con la ciudadanía,,,,"Focalización: educación, salud y servicios sociales",,,,,,,,No,,,,,,,,,,,,,,,,,,,Sí,No,Sí,Sí,,"Fundamentos de IA y conocimientos generales (Introducción a la IA, Ética en la IA, Privacidad y protección de datos, Gobernanza y estrategia en IA, etc.)","Habilidades técnicas (Análisis y gestión de datos, Machine Learning y Deep Learning, Ciberseguridad en entornos de IA, Integración de soluciones IA, etc.)","Gestión y evaluación de proyectos IA (Diseño y desarrollo de proyectos IA, Selección de proveedores y evaluación de propuestas, Evaluación del impacto y resultados, etc.)","Áreas de aplicación práctica (Automatización de procesos, Análisis predictivo y toma de decisiones basadas en datos, Atención al ciudadano, Seguridad y monitoreo, etc.)","Colaboración y cultura organizacional (Cambio cultural y liderazgo digital, Colaboración interinstitucional, Participación ciudadana y transparencia, etc.)",,No,1,Altas,No,,,Diseño y entrega de servicios públicos,,,"GABRIELA MISTRAL AI. AVATAR    Funciona en una pantalla de ultima tecnología nuestra premio NOBEL estará a tamaño real de manera permanente en la biblioteca nacional. Con una capacidad única de interactuar con los asistentes en tiempo real, contando su historia, respondiendo preguntas, leyendo poemas y interactuando de manera educativa con todos los asistentes.    El avatar AI. de Gabriel Mistral será nutrido por información relevante de todas las areas las cuales queramos que interactúe con el publico asistente.    Cabe mencionar que es un proyecto en desarrollo.",Pendiente,Aun en etapa de anteproyecto,Aun en etapa de anteproyecto,Aun en etapa de anteproyecto,Sí,No,No,,No,No,,Moderado,Sí,No,Sí,No
PE-SER-00125,114807466324,Encargado de informatica,Masculino,Servicio de Vivienda y Urbanización Región del Libertador General Bernardo O'Higgins,Segunda jerarquía,Libertador General Bernardo O'Higgins,Bajo,No,,No se ha utilizado,,"Falta de conocimiento o comprensión sobre la IA (usos, beneficios)",Costos elevados de implementación,,Falta de infraestructura tecnológica,,,,,,,,,,Limitaciones de infraestructura tecnológica,,Presupuesto insuficiente para cubrir costos de implementación o mantenimiento,,,,,,No,,,No,,,,,,,,,,,,,,,,,,,,,,,,,,,,,,,,,,,,,,,,,,,,,,,,,,,,,,,,,,,,,,,,,,,,,,,,
PE-SER-00114,114799857949,Encargado Oficina de Informática,Masculino,Servicio de Vivienda y Urbanización Región de La Araucanía,Dependencia directa del jefe superior,La Araucanía,Bajo,No,,No se ha utilizado,,"Falta de conocimiento o comprensión sobre la IA (usos, beneficios)",Costos elevados de implementación,Falta de personal capacitado,Falta de infraestructura tecnológica,"Preocupaciones de ciberseguridad (privacidad, vulnerabilidades y seguridad)",,,,,Falta de apoyo de niveles más estratégicos para la adopción de la tecnología,,,Falta de personal capacitado en IA,Limitaciones de infraestructura tecnológica,Dificultades de integración de soluciones con los sistemas existentes,Presupuesto insuficiente para cubrir costos de implementación o mantenimiento,Falta de datos de calidad para entrenar modelos (en caso de soluciones a medida),Preocupaciones de ciberseguridad (riesgos asociados como vulnerabilidades de los algoritmos o fugas de datos que puedan ser sensibles),Escalabilidad de las soluciones,Complejidad de la gestión de cambios tecnológicos,,No,,,No,,,,,,,,,,,,,,,,,,,,,,,,,,,,,,,,,,,,,,,,,,,,,,,,,,,,,,,,,,,,,,,,,,,,,,,,
PE-SER-00124,114806461825,Encargado de Sistemas - Sección Informática - SERVIU RM,Masculino,Servicio de Vivienda y Urbanización Región Metropolitana,Tercera jerarquía,Metropolitana de Santiago,Bajo,Sí,"Sí, pero sólo para algunos datos",Inicial (prueba de concepto/un proyecto),,,,,,,,,,,,,,,,,,,,,,,,,,,,,,,,,,,,,,,,,,solo consultas y preguntas realizadas por funcionarios(as),No,,,,,,,,,,,,,,,,,,,No,,No,Sí,,"Fundamentos de IA y conocimientos generales (Introducción a la IA, Ética en la IA, Privacidad y protección de datos, Gobernanza y estrategia en IA, etc.)","Habilidades técnicas (Análisis y gestión de datos, Machine Learning y Deep Learning, Ciberseguridad en entornos de IA, Integración de soluciones IA, etc.)",,"Áreas de aplicación práctica (Automatización de procesos, Análisis predictivo y toma de decisiones basadas en datos, Atención al ciudadano, Seguridad y monitoreo, etc.)",,,No,Ningún proyecto,No hay expectativas,No,,Procesos internos,,,Consulta y preguntas relacionadas a nuestros procesos y procedimientos.,Actualmente no existe ninguna iniciativa respecto de lo consultado.,Actualmente no existe ninguna iniciativa respecto de lo consultado.,Formalmente no hemos aplicado este lineamiento. ,Formalmente no hemos aplicado este lineamiento.,"Esto se aplica de acuerdo a los procedimientos de la seguridad de la información, como también aplicamos procedimientos respecto de Ciberseguridad.",No,,No,,No,No,,Bajo,No,No,No,
PE-SER-00611,114798290558,Encargado TI,Masculino,Servicio Local de Educación Pública de Andalién Sur,Tercera jerarquía,Biobío,Bajo,No,,En evaluación,,,Costos elevados de implementación,,,"Preocupaciones de ciberseguridad (privacidad, vulnerabilidades y seguridad)",,"Incertidumbre sobre cómo usar la IA de forma legal, ética (regulaciones)",,,,,,,,,Presupuesto insuficiente para cubrir costos de implementación o mantenimiento,,Preocupaciones de ciberseguridad (riesgos asociados como vulnerabilidades de los algoritmos o fugas de datos que puedan ser sensibles),Escalabilidad de las soluciones,,,Sí,No,,Sí,No,,,,,,,,,,,,,,,,,,,,,,,,,,,,,,,,,,,,,,,,,,,,,,,,,,,,,,,,,,,,,,,,,,,,,,,
PE-SER-00608,114798353674,Profesional TIC,Masculino,Servicio Local de Educación Pública de Colchagua,Segunda jerarquía,Libertador General Bernardo O'Higgins,Bajo,Sí,"Sí, pero sólo para algunos datos",Inicial (prueba de concepto/un proyecto),,,,,,,,,,,,,,,,,,,,,,,,,,,,,,Automatización de procesos y gestión operativa,,Analítica avanzada para la toma de decisiones,,,,,,,,,Monitoreo y evaluación de proyectos,,No,,,,,,,,,,,,,,,,,,,No,,Sí,Sí,,,"Habilidades técnicas (Análisis y gestión de datos, Machine Learning y Deep Learning, Ciberseguridad en entornos de IA, Integración de soluciones IA, etc.)","Gestión y evaluación de proyectos IA (Diseño y desarrollo de proyectos IA, Selección de proveedores y evaluación de propuestas, Evaluación del impacto y resultados, etc.)","Áreas de aplicación práctica (Automatización de procesos, Análisis predictivo y toma de decisiones basadas en datos, Atención al ciudadano, Seguridad y monitoreo, etc.)",,,No,0,0,Sí,,Procesos internos,,Elaboración o apoyo de políticas,"Más que iniciativas propias asociadas a la IA, se ha utilizado para el apoyo y generación de documentación, requerimientos, etc.",.,.,.,.,.,No,,No,,No,No,,Bajo,No,No,No,
