PE-MIN-00539,114814144485,Profesional PMO. CNT - DIPLAP,Masculino,Ministerio de Educación,Segunda jerarquía,Metropolitana de Santiago,Bajo,Sí,"Sí, pero sólo para algunos datos",Inicial (prueba de concepto/un proyecto),,,,,,,,,,,,,,,,,,,,,,,,,,,,,,,Mejora de la interacción con la ciudadanía,,,,"Focalización: educación, salud y servicios sociales",,,,,,,,No,,,,,,,,,,,,,,,,,,,Sí,Sí,No,Sí,,"Fundamentos de IA y conocimientos generales (Introducción a la IA, Ética en la IA, Privacidad y protección de datos, Gobernanza y estrategia en IA, etc.)","Habilidades técnicas (Análisis y gestión de datos, Machine Learning y Deep Learning, Ciberseguridad en entornos de IA, Integración de soluciones IA, etc.)","Gestión y evaluación de proyectos IA (Diseño y desarrollo de proyectos IA, Selección de proveedores y evaluación de propuestas, Evaluación del impacto y resultados, etc.)",,,,No,"Desarrollo Interno o Contratación con productos en producción, 0. No obstante, se han ejecutado o encuentran en Ejecución 4 POC.",Evaluar la solución usando IA para determinar éxito de la solución frente a otras alternativas.,Sí,,,Diseño y entrega de servicios públicos,,,*	POC Captura de datos de documentos digitalizados de actas de estudio.  *	POC Búsqueda de información en gran cantidad de documentos no organizados.   *	POC Asistente virtual apoyo estudiante Educación Superior programa Apelación Gratuidad.  *	POC Asistente virtual apoyo estudiante Educación Superior programa Formulario único admisión Educ. Superior.  ,"Alternativa no fue marcada, no obstante, se desplegó pregunta de forma obligatoria.","1. Una de las dificultades principales es no contar con conocimiento, metodología, capacitación de los equipos y herramientas de implementación para este este tipo de modelos IA.  2.Disponer de una caracterización de la población objetivo lo suficientemente diversa para modelar un lenguaje de uso que permita no caer en sesgos, así como evitar alucinaciones debido el lenguaje y modismos bajo los cuales se suele preguntar a agentes virtuales.  3. Poder incluir a la ciudadanía en el diseño e  implementación de herramientas de inteligencia artificial. Esto se debe principalmente a que se han trabajado mediante POC.  4. Implementar los lineamientos de la Guía de Formulación Ética de Proyectos de Ciencia de Datos, debido a que se a trabajado mediante POC.","1. No se han presentado mayores dificultades aún debido a que las iniciativas han sido abordadas a través de POC. No obstante, se espera que aquellas a desarrollar y que pasen a producción, puedan ser evaluadas posteriormente. ","1. No se han presentado mayores dificultades aún debido a que las iniciativas han sido abordadas a través de POC. Por tanto se ha trabajado en entornos institucionales y con NDA firmados, esto, principalmente asociado al entrenamiento de herramientas de IA. ",No,No,No,,No,No,,Bajo,No,No,Sí,Si
PE-MIN-00535,114798340599,Jefe (S) Tecnologias de la Informacion,Masculino,Ministerio de la Mujer y la Equidad de Género,Segunda jerarquía,Metropolitana de Santiago,Bajo,No,,No se ha utilizado,,"Falta de conocimiento o comprensión sobre la IA (usos, beneficios)",,Falta de personal capacitado,,,,,,,Falta de apoyo de niveles más estratégicos para la adopción de la tecnología,,,Falta de personal capacitado en IA,Limitaciones de infraestructura tecnológica,,,,,,Complejidad de la gestión de cambios tecnológicos,,No,,,No,,,,,,,,,,,,,,,,,,,,,,,,,,,,,,,,,,,,,,,,,,,,,,,,,,,,,,,,,,,,,,,,,,,,,,,,
PE-MIN-00530,114803637444,Jefe de proyectos,Femenino,Ministerio de salud,Tercera jerarquía,Metropolitana de Santiago,Bajo,Sí,"Sí, pero sólo para algunos datos",En evaluación,,"Falta de conocimiento o comprensión sobre la IA (usos, beneficios)",Costos elevados de implementación,Falta de personal capacitado,,,,,,,,,,,,,Presupuesto insuficiente para cubrir costos de implementación o mantenimiento,,,,,,Sí,No,,Sí,No,,,,,,,,,,,,,,,,,,,,,,,,,,,,,,,,,,,,,,,,,,,,,,,,,,,,,,,,,,,,,,,,,,,,,,,
PE-FOS-00598,114810010654,Jefe Plana Mayor Jefatura Nacional de Tecnologías de la Información y Transformación Digital,Masculino,Policía de Investigaciones de Chile,Segunda jerarquía,Metropolitana de Santiago,Alto,Sí,"Sí, pero sólo para algunos datos",Inicial (prueba de concepto/un proyecto),,,,,,,,,,,,,,,,,,,,,,,,,,,,,,,,,,,,,,,,,,Reconocimiento biométrico,No,,,,,,,,,,,,,,,,,,,No,,Sí,Sí,,,"Habilidades técnicas (Análisis y gestión de datos, Machine Learning y Deep Learning, Ciberseguridad en entornos de IA, Integración de soluciones IA, etc.)","Gestión y evaluación de proyectos IA (Diseño y desarrollo de proyectos IA, Selección de proveedores y evaluación de propuestas, Evaluación del impacto y resultados, etc.)","Áreas de aplicación práctica (Automatización de procesos, Análisis predictivo y toma de decisiones basadas en datos, Atención al ciudadano, Seguridad y monitoreo, etc.)","Colaboración y cultura organizacional (Cambio cultural y liderazgo digital, Colaboración interinstitucional, Participación ciudadana y transparencia, etc.)",,Sí,3,Aplicación de procesos,Sí,,Procesos internos,,,Apoyo a la investigación de sujetos de interés en algunas investigaciones que realizan nuestros detectives,No tenemos de momento,No tenemos de momento,No hemos tenido dificultades.,No hemos tenido dificultades.,Sin reparos,No,,No,,No,No,,Bajo,No,No,No,
No tiene código,114798392726,Encargado de Informática,Masculino,Primer Tribunal Ambiental,Dependencia directa del jefe superior,Antofagasta,Medio,No,,En evaluación,,,,,,,,,,,Falta de apoyo de niveles más estratégicos para la adopción de la tecnología,Falta de personal en la unidad de informática,,,,,Presupuesto insuficiente para cubrir costos de implementación o mantenimiento,Falta de datos de calidad para entrenar modelos (en caso de soluciones a medida),,,,,No,,,No,,,,,,,,,,,,,,,,,,,,,,,,,,,,,,,,,,,,,,,,,,,,,,,,,,,,,,,,,,,,,,,,,,,,,,,,
No tiene código,114809426907,Abogada Relatora,Femenino,Primer Tribunal Electoral de la Región Metropolitana,Dependencia directa del jefe superior,Metropolitana de Santiago,Bajo,No,,No se ha utilizado,,"Falta de conocimiento o comprensión sobre la IA (usos, beneficios)",,Falta de personal capacitado,,,,"Incertidumbre sobre cómo usar la IA de forma legal, ética (regulaciones)",,,,,,Falta de personal capacitado en IA,,,,,,,,,No,,,No,,,,,,,,,,,,,,,,,,,,,,,,,,,,,,,,,,,,,,,,,,,,,,,,,,,,,,,,,,,,,,,,,,,,,,,,
PE-DGN-00602,114814193907,JEFE SUBDEPARTAMENTO PROYECTOS TECNOLÓGICOS,Masculino,Dirección General de Promoción de Exportaciones,Dependencia directa del jefe superior,Metropolitana de Santiago,Medio,No,,Inicial (prueba de concepto/un proyecto),,,,,,,,,,,,,,,,,,,,,,,,,,,,,,,Mejora de la interacción con la ciudadanía,,,,,,,,,,,Ofimática ,Sí,,,,,,,Escasez de datos de calidad,,Falta de personal capacitado,,Resistencia cultural al cambio,,Costo elevado de soluciones de IA,Preocupaciones sobre privacidad y ética,,Visión estratégica limitada,,,No,,Sí,Sí,,"Fundamentos de IA y conocimientos generales (Introducción a la IA, Ética en la IA, Privacidad y protección de datos, Gobernanza y estrategia en IA, etc.)","Habilidades técnicas (Análisis y gestión de datos, Machine Learning y Deep Learning, Ciberseguridad en entornos de IA, Integración de soluciones IA, etc.)",,"Áreas de aplicación práctica (Automatización de procesos, Análisis predictivo y toma de decisiones basadas en datos, Atención al ciudadano, Seguridad y monitoreo, etc.)",,,No,2,"Las expectativas para un LLM (Large Language Model) dirigido al público general de ProChile incluyen la capacidad de proporcionar respuestas contextuales y personalizadas a consultas sobre exportación, utilizando procesamiento de lenguaje natural. Asimismo, su función es respaldar la toma de decisiones estratégicas mediante el análisis de datos relevantes y estudios de mercado, ofreciendo recomendaciones fundamentadas.",Sí,,Procesos internos,Diseño y entrega de servicios públicos,,"Utilizamos Copilot Pro para facilitar tareas ofimáticas, como la generación de documentos, el análisis de datos y la organización de información, mejorando la eficiencia en nuestros procesos internos.","Nuestras iniciativas buscan mejorar la experiencia del usuario mediante el uso de tecnologías avanzadas como LLM con IA, que optimizan la interacción con los estudios de mercados. Iniciativas: Automatización de servicios (chatbots o asistentes virtuales basados en IA), Optimización de procesos administrativos y Análisis de datos para toma de decisiones.",No aplica. ,"Levantamiento de información relevante para ser utilizada como base de conocimiento, control de expectativas mediante la aplicación de IA y gestión de costos variables.              ","Ninguna. Azure AI proporciona herramientas de auditoría y explicabilidad, y los modelos utilizados han sido configurados para garantizar transparencia en sus respuestas.","Ninguna. Los datos utilizados son públicos y los desarrollos en Azure AI se realizaron en ambientes controlados, asegurando el cumplimiento de sus medidas de privacidad y seguridad por defecto.",No,,No,,Sí,No,,Moderado,Sí,Sí,Sí,No
No tiene código,114812805732,Encargado TI,Masculino,Segundo Tribunal Ambiental,Dependencia directa del jefe superior,Metropolitana de Santiago,Bajo,No,,En evaluación,,"Falta de conocimiento o comprensión sobre la IA (usos, beneficios)",Costos elevados de implementación,Falta de personal capacitado,,"Preocupaciones de ciberseguridad (privacidad, vulnerabilidades y seguridad)",,"Incertidumbre sobre cómo usar la IA de forma legal, ética (regulaciones)",,,,,,Falta de personal capacitado en IA,,Dificultades de integración de soluciones con los sistemas existentes,Presupuesto insuficiente para cubrir costos de implementación o mantenimiento,,Preocupaciones de ciberseguridad (riesgos asociados como vulnerabilidades de los algoritmos o fugas de datos que puedan ser sensibles),,,,No,,,No,,,,,,,,,,,,,,,,,,,,,,,,,,,,,,,,,,,,,,,,,,,,,,,,,,,,,,,,,,,,,,,,,,,,,,,,
PE-SER-00106,114798401222,Jefe TI (S),Masculino,Servicio Nacional de la Discapacidad,Tercera jerarquía,Metropolitana de Santiago,Medio,No,,En evaluación,,,,,Falta de infraestructura tecnológica,"Preocupaciones de ciberseguridad (privacidad, vulnerabilidades y seguridad)",,"Incertidumbre sobre cómo usar la IA de forma legal, ética (regulaciones)",,,,,,Falta de personal capacitado en IA,Limitaciones de infraestructura tecnológica,,,,Preocupaciones de ciberseguridad (riesgos asociados como vulnerabilidades de los algoritmos o fugas de datos que puedan ser sensibles),,,,No,,,No,,,,,,,,,,,,,,,,,,,,,,,,,,,,,,,,,,,,,,,,,,,,,,,,,,,,,,,,,,,,,,,,,,,,,,,,
PE-SER-00104,114799136034,Administrador de Infraestructura TI,Masculino,Servicio Nacional de Menores,Tercera jerarquía,Metropolitana de Santiago,Bajo,No,,No se ha utilizado,,"Falta de conocimiento o comprensión sobre la IA (usos, beneficios)",,Falta de personal capacitado,,"Preocupaciones de ciberseguridad (privacidad, vulnerabilidades y seguridad)",Resistencia al cambio a nivel organizacional,"Incertidumbre sobre cómo usar la IA de forma legal, ética (regulaciones)",,,Falta de apoyo de niveles más estratégicos para la adopción de la tecnología,Sename está en proceso de transformación hacia otro Servicio,,Falta de personal capacitado en IA,Limitaciones de infraestructura tecnológica,,Presupuesto insuficiente para cubrir costos de implementación o mantenimiento,,Preocupaciones de ciberseguridad (riesgos asociados como vulnerabilidades de los algoritmos o fugas de datos que puedan ser sensibles),,Complejidad de la gestión de cambios tecnológicos,,No,,,No,,,,,,,,,,,,,,,,,,,,,,,,,,,,,,,,,,,,,,,,,,,,,,,,,,,,,,,,,,,,,,,,,,,,,,,,
PE-SER-00572,114806345993,JEFE TIC,Masculino,Servicio Nacional para la Prevención y Rehabilitación del Consumo de Drogas y Alcohol,Otra,Metropolitana de Santiago,Bajo,No,,En evaluación,,"Falta de conocimiento o comprensión sobre la IA (usos, beneficios)",,,,"Preocupaciones de ciberseguridad (privacidad, vulnerabilidades y seguridad)",,"Incertidumbre sobre cómo usar la IA de forma legal, ética (regulaciones)",,,,,,Falta de personal capacitado en IA,,Dificultades de integración de soluciones con los sistemas existentes,,,Preocupaciones de ciberseguridad (riesgos asociados como vulnerabilidades de los algoritmos o fugas de datos que puedan ser sensibles),,,Disponibilidad de HH para dedicar a estas materias,Sí,No,,No,,,,,,,,,,,,,,,,,,,,,,,,,,,,,,,,,,,,,,,,,,,,,,,,,,,,,,,,,,,,,,,,,,,,,,,,
PE-SER-00134,114810894222,Especialista Infraestructura de Datos Espaciales,Masculino,Servicio Aerofotogramétrico del General Juan Soler Manfredini,Segunda jerarquía,Metropolitana de Santiago,Bajo,No,,Inicial (prueba de concepto/un proyecto),,,,,,,,,,,,,,,,,,,,,,,,,,,,,,Automatización de procesos y gestión operativa,,,,,,,,,,Asistencia en emergencias y gestión de desastres,,,No,,,,,,,,,,,,,,,,,,,No,,Sí,Sí,,"Fundamentos de IA y conocimientos generales (Introducción a la IA, Ética en la IA, Privacidad y protección de datos, Gobernanza y estrategia en IA, etc.)","Habilidades técnicas (Análisis y gestión de datos, Machine Learning y Deep Learning, Ciberseguridad en entornos de IA, Integración de soluciones IA, etc.)","Gestión y evaluación de proyectos IA (Diseño y desarrollo de proyectos IA, Selección de proveedores y evaluación de propuestas, Evaluación del impacto y resultados, etc.)","Áreas de aplicación práctica (Automatización de procesos, Análisis predictivo y toma de decisiones basadas en datos, Atención al ciudadano, Seguridad y monitoreo, etc.)","Colaboración y cultura organizacional (Cambio cultural y liderazgo digital, Colaboración interinstitucional, Participación ciudadana y transparencia, etc.)",,No,1,Poder automatizar foto-interpretar imágenes aéreas.,Sí,,Procesos internos,,,"En caso de emergencia, poder disminuir los tiempos de foto-interpretación de imágenes aéreas.",no aplica,no aplica,"En el ámbito de conocimientos, ya que falta personal capacitado para realizar análisis de este tipo de proyectos y con una seguridad informática muy restrictivas no hay un lineamiento en el uso de herramientas de IA a nivel institucional.","igual que en el párrafo anterior, no hay lineamientos a nivel institucional en el uso de herramientas de IA, por lo mismo, no se ha aplicado este lineamiento.","no se ha aplicado este lineamiento, ya que no hay un lineamiento claro a nivel institucional.",No,,No,,No,No,,Bajo,No,No,No,
PE-SER-00730,114806641712,Encargado Sección Inteligencia Artificial y Ciencia de Datos,Masculino,Servicio Agrícola y Ganadero,Segunda jerarquía,Metropolitana de Santiago,Bajo,No,,Inicial (prueba de concepto/un proyecto),,,,,,,,,,,,,,,,,,,,,,,,,,,,,,Automatización de procesos y gestión operativa,Mejora de la interacción con la ciudadanía,Analítica avanzada para la toma de decisiones,Selección de casos de fiscalización,,,,,,,,,,No,,,,,,,,,,,,,,,,,,,Sí,No,Sí,Sí,,,"Habilidades técnicas (Análisis y gestión de datos, Machine Learning y Deep Learning, Ciberseguridad en entornos de IA, Integración de soluciones IA, etc.)","Gestión y evaluación de proyectos IA (Diseño y desarrollo de proyectos IA, Selección de proveedores y evaluación de propuestas, Evaluación del impacto y resultados, etc.)","Áreas de aplicación práctica (Automatización de procesos, Análisis predictivo y toma de decisiones basadas en datos, Atención al ciudadano, Seguridad y monitoreo, etc.)",,,No,3,"Automatizar procesos, disminuir los sesgos optimizar recursos.",Sí,,Procesos internos,,Elaboración o apoyo de políticas,1.- Implementar la gobernanza de datos.  2.- Implementar data Fabric.  3.- Promover una cultura de datos.,1.- Chatbots para ayuda al público.  2.- Disponibilización de datos públicos.,"Herramientas de apoyo a la toma de decisiones basadas en datos. Por ejemplo, selección de entidades fiscalizables, Investigación asociadas a denuncias y Inspección de mercancías en controles fronterizos.",1.- Comunicar e interpretar los resultados para que las personas entiendan.   2.- Hacer que la IA entregue respuestas precisas.,1.- El público no está suficientemente instruido para comprender el alcance de la IA.,1.- No se han presentado problemas aún en ese sentido.,Sí,Sí,Sí,1.- La guía introduce más burocracia a la gestión del proyecto.,No,No,,Alto,Sí,Sí,Sí,No
PE-SER-00713,114798908732,Gerente de Tecnología y Sistemas,Masculino,Servicio de Cooperación Técnica,Dependencia directa del jefe superior,Metropolitana de Santiago,Medio,No,,Inicial (prueba de concepto/un proyecto),,,,,,,,,,,,,,,,,,,,,,,,,,,,,,Automatización de procesos y gestión operativa,,,,,,,,,,,,,No,,,,,,,,,,,,,,,,,,,No,,Sí,Sí,,"Fundamentos de IA y conocimientos generales (Introducción a la IA, Ética en la IA, Privacidad y protección de datos, Gobernanza y estrategia en IA, etc.)","Habilidades técnicas (Análisis y gestión de datos, Machine Learning y Deep Learning, Ciberseguridad en entornos de IA, Integración de soluciones IA, etc.)",,,"Colaboración y cultura organizacional (Cambio cultural y liderazgo digital, Colaboración interinstitucional, Participación ciudadana y transparencia, etc.)",,No,2,Optimizar procesos y entregar soluciones que permitan la autoatención.,Sí,,Procesos internos,,,"Implementación de una prueba de concepto para el almacenamiento y consulta de documentación en formato Markdown mediante una base de datos vectorial. Esta solución permite que la IA analice y responda preguntas relacionadas con procedimientos, resoluciones, temas de RRHH, mesa de ayuda y otros contenidos relevantes.    Otra iniciativa es la evaluación de respuestas del modelo canvas a partir de las rubricas de cada pregunta para asignar una nota y entregar una justificación. Esto permite realizar el calculo final de nota.",Aún no tenemos iniciativas en diseño y entrega de servicios públicos. Estamos realizando POC para procesos internos.,Aún no aplicado.,"Más que dificultades, estamos realizando pruebas de concepto para procesos internos. Revisando resultados para luego diseñar e implementar soluciones con IA centrada en las personas.",Aún no se ha implementado.,Ninguna dificultad.,No,,No,,Sí,No,,Moderado,Sí,No,Sí,No
PE-SER-00132,114798343948,Encargado PMO,Masculino,Servicio de Evaluación Ambiental,Dependencia directa del jefe superior,Metropolitana de Santiago,Medio,Sí,"Sí, pero sólo para algunos datos",Inicial (prueba de concepto/un proyecto),,,,,,,,,,,,,,,,,,,,,,,,,,,,,,,,Analítica avanzada para la toma de decisiones,,,,,,,,,Monitoreo y evaluación de proyectos,,No,,,,,,,,,,,,,,,,,,,No,,Sí,Sí,,"Fundamentos de IA y conocimientos generales (Introducción a la IA, Ética en la IA, Privacidad y protección de datos, Gobernanza y estrategia en IA, etc.)","Habilidades técnicas (Análisis y gestión de datos, Machine Learning y Deep Learning, Ciberseguridad en entornos de IA, Integración de soluciones IA, etc.)","Gestión y evaluación de proyectos IA (Diseño y desarrollo de proyectos IA, Selección de proveedores y evaluación de propuestas, Evaluación del impacto y resultados, etc.)","Áreas de aplicación práctica (Automatización de procesos, Análisis predictivo y toma de decisiones basadas en datos, Atención al ciudadano, Seguridad y monitoreo, etc.)","Colaboración y cultura organizacional (Cambio cultural y liderazgo digital, Colaboración interinstitucional, Participación ciudadana y transparencia, etc.)","Modelos de similitudes, estadísticas de datos",No,0,El proyecto se encuentra en proceso de adquisición,No,,Procesos internos,,,"Se busca contar con información transversal desde la historia de los proyectos sometidos al SEIA para nutrir la evaluación ambiental, y tomar decisiones estratégicas con la experiencia adquirida",no aplica,no aplica,"En el proyecto que desarrollaremos durante el año 2025, unos de los problemas que abordaremos sobre este lineamiento será evaluar si el uso de inteligencia artificial es la solución tecnológica más adecuada tanto para atender las necesidades ciudadanas como de buen servicio.","En el proyecto del año 2025, sobre este tema la dificultad detectada esta relacionada con informar a la ciudadanía sobre el uso de herramientas de inteligencia artificial de manera clara y accesible","El cumplimiento de las regulaciones existentes, como la protección de datos personales, puede ser complicado en el contexto de la implementación de la inteligencia artificial",No,,No,,No,No,,Bajo,Sí,No,No,
PE-GOR-00564,114798324847,Profesional TI,Masculino,Gobierno Regional de la Región de Magallanes y de la Antártica Chilena,Tercera jerarquía,Magallanes y de la Antártica Chilena,Bajo,No,,En evaluación,,,Costos elevados de implementación,,,,,"Incertidumbre sobre cómo usar la IA de forma legal, ética (regulaciones)",,,,,,Falta de personal capacitado en IA,Limitaciones de infraestructura tecnológica,Dificultades de integración de soluciones con los sistemas existentes,Presupuesto insuficiente para cubrir costos de implementación o mantenimiento,,,,,,No,,,No,,,,,,,,,,,,,,,,,,,,,,,,,,,,,,,,,,,,,,,,,,,,,,,,,,,,,,,,,,,,,,,,,,,,,,,,
PE-SER-00146,114800081930,Jefe Oficina Sistemas de Inteligencia de Negocios,Masculino,Servicio de Impuestos Internos,Dependencia directa del jefe superior,Metropolitana de Santiago,Bajo,Sí,"Sí, pero sólo para algunos datos",Inicial (prueba de concepto/un proyecto),,,,,,,,,,,,,,,,,,,,,,,,,,,,,,,Mejora de la interacción con la ciudadanía,,Selección de casos de fiscalización,"Detección de fraudes, comportamientos anómalos y ciberseguridad",,,,,,,,,Sí,,,,Capacidad de adquisición limitada,,,,Complejidad en la integración de sistemas,Falta de personal capacitado,Desconocimiento sobre las tecnologías disponibles,,Restricciones presupuestarias,,Preocupaciones sobre privacidad y ética,Falta de confianza en los proveedores,,Ausencia de métricas claras,,No,,Sí,Sí,,"Fundamentos de IA y conocimientos generales (Introducción a la IA, Ética en la IA, Privacidad y protección de datos, Gobernanza y estrategia en IA, etc.)","Habilidades técnicas (Análisis y gestión de datos, Machine Learning y Deep Learning, Ciberseguridad en entornos de IA, Integración de soluciones IA, etc.)","Gestión y evaluación de proyectos IA (Diseño y desarrollo de proyectos IA, Selección de proveedores y evaluación de propuestas, Evaluación del impacto y resultados, etc.)",,,,No,5,"Implementación rápida, facilidad para usuarios, proveedores con experiencia, costos acotados y predecibles, capacidad para utilizar diferentes herramientas.",No,,Procesos internos,Diseño y entrega de servicios públicos,,Desarrollo de modelos con ML para detección de comportamientos anómalos y de clasificación.  Apoyo a la revisión y preparación de documentos jurídicos.  ,Facilitar  la interacción de contribuyentes con el portal institucional.  ,No aplica,"Por la naturaleza de la acción fiscalizadora de nuestra institución, se dificulta integrar a la ciudadanía en el diseño e implementación de herramientas con IA cuando estos apoyan la labor fiscalizadora.",Aún no se cuenta con experiencia en este ámbito.,Hasta el momento ninguna,Sí,No,No,,No,No,,Bajo,Sí,No,No,
PE-SER-00129,114799005259,Subdirector de Estudios y Desarrollo (S).,Masculino,Servicio de Registro Civil e Identificación,Dependencia directa del jefe superior,Metropolitana de Santiago,Bajo,No,,Inicial (prueba de concepto/un proyecto),,,,,,,,,,,,,,,,,,,,,,,,,,,,,,,Mejora de la interacción con la ciudadanía,,,,,,,,,,,,No,,,,,,,,,,,,,,,,,,,No,,Sí,Sí,,"Fundamentos de IA y conocimientos generales (Introducción a la IA, Ética en la IA, Privacidad y protección de datos, Gobernanza y estrategia en IA, etc.)","Habilidades técnicas (Análisis y gestión de datos, Machine Learning y Deep Learning, Ciberseguridad en entornos de IA, Integración de soluciones IA, etc.)","Gestión y evaluación de proyectos IA (Diseño y desarrollo de proyectos IA, Selección de proveedores y evaluación de propuestas, Evaluación del impacto y resultados, etc.)",,,,No,"uno, chat bot en la página del SERVICIO",mejorar la experiencia del usuario en horario continuo a consultas,Sí,,,Diseño y entrega de servicios públicos,,,Actualmente solo se posee chat bot.,Ninguna,No se ha aplicado estos lineamientos en la institución en la actualidad.,No se ha aplicado estos lineamientos en la institución en la actualidad.,No se ha aplicado estos lineamientos en la institución en la actualidad.,No,,No,,No,No,,Bajo,No,No,No,
PE-SSS-00071,114798346561,Jefe de Unidad de Desarrollo y Tecnologías,Masculino,Servicio de Salud Araucanía Sur,Dependencia directa del jefe superior,La Araucanía,Medio,Sí,"No, pero se está trabajando en esos temas",Inicial (prueba de concepto/un proyecto),,,,,,,,,,,,,,,,,,,,,,,,,,,,,,,,,,,,,,,,,,Generación de scripts y desarrollo de software,No,,,,,,,,,,,,,,,,,,,No,,Sí,Sí,,"Fundamentos de IA y conocimientos generales (Introducción a la IA, Ética en la IA, Privacidad y protección de datos, Gobernanza y estrategia en IA, etc.)","Habilidades técnicas (Análisis y gestión de datos, Machine Learning y Deep Learning, Ciberseguridad en entornos de IA, Integración de soluciones IA, etc.)",,"Áreas de aplicación práctica (Automatización de procesos, Análisis predictivo y toma de decisiones basadas en datos, Atención al ciudadano, Seguridad y monitoreo, etc.)",,,No,1,"Automatización en la revisión de servidores y sus configuraciones, junto con una monitorización asistida.",No,,Procesos internos,,,Monitoreo de servidores y desarrollo de software,-,-,-,-,-,No,,No,,No,No,,Bajo,No,No,No,
